,utterance,classes,snli
281,i would like to make a transfer how much does it cost?,"['make transfer', 'cost transfer']",make transfer
282,i need to make a transfer what will the fee be?,"['make transfer', 'make fee']",make transfer
283,if i make a top-up are there charges applied?,"['make topup', 'applied charges']",make topup
284,can i also transfer with swift?,['transfer '],transfer 
285,are swift transfers accepted?,"['swift transfers', 'accepted transfers']",swift transfers
286,i would like to refill my account using swift,"['using account', 'using account']",Unknown
287,do i have to pay for topping up by transfer?,['topping transfer'],topping transfer
288,are there any sort of fees involved for top of transfers?,['involved transfers'],involved transfers
289,is it possible to get a transfer from swift?,"['get transfer', 'get transfer']",Unknown
290,do i have to pay any fees in order to receive money?,"['receive money', 'receive money']",receive money
291,how much am i charged to receive money?,"['receive money', 'receive money']",receive money
292,will you deal with swift transfers?,"['swift transfers', 'deal transfers']",swift transfers
293,will there be any charges for money received?,['received money'],received money
294,will a transfer incur a fee?,"['incur fee', 'incur fee']",incur fee
295,are there charges for receiving a sepa transfer?,"['receiving transfer', 'sepa transfer', 'receiving transfer']",Unknown
296,if i transfer money from my bank to top-up my account will i be charged?,"['topup account', 'charged account']",topup account
297,will i be charged if someone needs to send me money?,"['send money', 'send money']",send money
298,what are the fees for top-ups?,[' topups'], topups
299,will topping up by transfer lead to a charge on my account?,['lead account'],lead account
300,what are the charges for receiving money?,"['receiving money', 'receiving money']",Unknown
301,what is the fee to receive money?,"['receive money', 'receive money']",Unknown
302,how much am i charged for a sepa transfer?,"['sepa transfer', 'charged transfer']",sepa transfer
303,how much is the fee for a sepa transfer?,"['sepa transfer', ' transfer']", transfer
304,what'll it charge me for a sepa transfer?,"['charge ', 'sepa transfer', 'charge transfer']",sepa transfer
305,is there a charge for topping up by transfer?,['topping transfer'],topping transfer
306,do you do swift transfers?,"['do transfers', 'swift transfers', 'do transfers']",Unknown
307,should i expect to be charged for topping up by transfer?,['topping transfer'],topping transfer
308,will i be charged for a sepa transfer?,"['sepa transfer', 'charged transfer']",sepa transfer
309,is there a fee for a transfer? if so how much will it be?,[' transfer'], transfer
310,please tell me about swift transfers at this bank,"['tell ', 'swift transfers', 'tell bank']",Unknown
311,is there a fee for transfer top-up?,"['transfer topup', ' topup']",transfer topup
312,can you tell me what the transfer policy is?,"['tell ', 'transfer policy', 'tell policy']",Unknown
313,is a swift transfer okay?,"['swift transfer', ' transfer']", transfer
314,will i be charged a fee if i receive a sepa transfer,"['receive transfer', 'sepa transfer', 'receive transfer']",sepa transfer
315,when topping up by transfer will i be charged?,['charged transfer'],charged transfer
316,what us the fee to transfer money from my bank?,"['transfer money', 'transfer bank']",transfer money
317,do i get charged if i am getting money?,"['getting money', 'getting money']",getting money
318,can you tell me the total cost of a transfer?,"['tell cost', 'total cost', 'tell transfer']",Unknown
319,please help me!  i need to cancel a transaction,"['cancel transaction', 'cancel transaction']",Unknown
320,can you limit my top up?,"['limit top', 'limit top']",Unknown
321,am i free to top-up as much as i want?,['want '],want 
322,is there a top up limit for my account?,"['top limit', 'top account']",top account
323,what is the limit to top up?,['top limit'],Unknown
324,how much money can i top up?,"['much money', 'top money']",top money
325,what are the restrictions to top-offs?,[' topoffs'], topoffs
326,are the top-ups limited?,[' topups'], topups
327,what is the top up limit,"['top limit', 'top limit']",top limit
328,i need to find out what is the limit for top-ups,['find topups'],find topups
329,do you have a limit to top ups?,"['have limit', 'top ups', 'have ups']",Unknown
330,what is maximum top up?,"['maximum top', ' top']", top
331,how can i tell what the limit is to top-ups?,['tell topups'],tell topups
332,is there a limit to top-up amounts?,"['topup amounts', ' amounts']",topup amounts
333,is there any limit to the amount i can add to a card at a time?,['add time'],add time
334,i want to know if there is a maximum i can top up,['top maximum'],Unknown
335,what is the limit to a top-up?,[' topup'], topup
336,tell me if there are any top-up limits?,"['tell ', 'topup limits', 'are limits']",topup limits
337,how can i top-up my limit?,"['topup limit', 'topup limit']",Unknown
338,is there a limit to top-ups?,[' topups'], topups
339,can i top-up as much as i want?,['want '],want 
340,can you tell me the limits for top ups?,"['tell limits', 'top ups', 'tell ups']",top ups
341,when i top up what are the amoutn limits,"['amoutn limits', 'top limits']",amoutn limits
342,is there a limit on top-ups?,[' topups'], topups
343,what is the top-ups limit?,"['topups limit', ' limit']", limit
344,are there limits to top-ups?,[' topups'], topups
345,is there a maximum amount of top-ups?,"['maximum amount', ' topups']", topups
346,do you have a top-up limit?,"['have limit', 'topup limit', 'have limit']",Unknown
347,what's the top up limit?,"['top limit', 'top limit']",Unknown
348,what is the limit to top-up?,[' topup'], topup
349,how much can i top-up to my card at a time?,['topup time'],topup time
350,how much can i top up?,['top '],Unknown
351,what is the most i can top up?,['top '],Unknown
352,is there a limit to how high i can top-up?,['topup limit'],topup limit
353,is there an amount limit to my top-up?,"['amount limit', ' topup']", topup
354,is there a limit for top-ups?,[' topups'], topups
355,is there a maximum i can top up?,['top maximum'],Unknown
356,how can i tell if there is a top-up limit?,"['topup limit', 'topup limit']",Unknown
357,do you have any restrictions to my top-up?,"['have restrictions', 'have topup']",have topup
358,as for limits are top ups included?,"['top ups', 'included ups']",top ups
359,which cards and currencies do you support?,['support currencies'],support currencies
360,where can i obtain my virtual card?,"['obtain card', 'virtual card', 'obtain card']",virtual card
361,how do you get a virtual card?,"['get card', 'virtual card', 'get card']",Unknown
362,where can i find a virtual card?,"['find card', 'virtual card', 'find card']",Unknown
363,is there an option to have a virtual card?,"[' card', 'virtual card', ' card']",Unknown
364,if i don't want a physical card can i get a virtual version?,"['get version', 'virtual version', 'get version']",Unknown
365,i requested a virtual card but it is not showing up why?,"['requested card', 'virtual card', 'showing card']",requested card
366,can you tell me how to order a virtual card?,"['order card', 'virtual card', 'order card']",virtual card
367,where is the virtual card?,"['virtual card', ' card']",virtual card
368,what is the virtual card,"['virtual card', ' card']",virtual card
369,how do i get a virtual card?,"['get card', 'virtual card', 'get card']",Unknown
370,where do i order a virtual card from?,"['order card', 'virtual card', 'order card']",virtual card
371,why did i not get a virtual card yet?,"['get card', 'virtual card', 'get card']",Unknown
372,how can i order virtual cards?,"['order cards', 'virtual cards', 'order cards']",Unknown
373,can you tell me where i can order a virtual card?,"['order card', 'virtual card', 'order card']",virtual card
374,is it possible for me to get a virtual card?,"['get card', 'virtual card', 'get card']",Unknown
375,is this where i order a virtual card?,"['order card', 'virtual card', 'order card']",Unknown
376,what are the steps to getting a virtual card?,"['getting card', 'virtual card', 'getting card']",Unknown
377,help me obtain a virtual card,"['obtain card', 'virtual card', 'obtain card']",Unknown
378,where is the virtual card located?,"['virtual card', 'located card']",virtual card
379,where can i order a virtual card?,"['order card', 'virtual card', 'order card']",virtual card
380,where do i obtain my virtual card?,"['obtain card', 'virtual card', 'obtain card']",Unknown
381,i want a virtual card!,"['want card', 'virtual card', 'want card']",Unknown
382,i want one of those virtual cards!,"['want ', 'virtual cards', 'want cards']",virtual cards
383,are virtual cards available to get?,"['virtual cards', 'get cards']",virtual cards
384,can you help me sign up for a virtual card?,"['virtual card', 'sign card']",virtual card
385,can i get a copy of the card by email?,"['get copy', 'get email']",get email
386,where do i find the virtual card?,"['find card', 'virtual card', 'find card']",virtual card
387,why do i not have a virtual card,"['have card', 'virtual card', 'have card']",virtual card
388,how do i order a virtual card?,"['order card', 'virtual card', 'order card']",Unknown
389,i thought i was going to get a virtual card but i haven't received it yet how can we resolve this?,"['resolve card', 'virtual card', 'resolve card']",virtual card
390,please help me get a virtual card,"['get card', 'virtual card', 'get card']",Unknown
391,can i order a virtual card?,"['order card', 'virtual card', 'order card']",Unknown
392,where can i go to get a virtual card?,"['get card', 'virtual card', 'get card']",Unknown
393,where are the virtual cards located?,"['virtual cards', 'located cards']",virtual cards
394,i would like a virtual card- where can i purchase one?,"['purchase one', 'virtual card', 'purchase one']",Unknown
395,when should i receive my virtual card?,"['receive card', 'virtual card', 'receive card']",Unknown
396,i need to reorder my virtual card!,"['reorder card', 'virtual card', 'reorder card']",virtual card
397,where can i get a virtual card?,"['get card', 'virtual card', 'get card']",virtual card
398,is there a way to obtain a virtual card?,"['obtain card', 'virtual card', 'obtain card']",Unknown
399,can i have one of the virtual cards?,"['have ', 'virtual cards', 'have cards']",virtual cards
400,will my card be accepted all over the world?,['accepted world'],Unknown
401,who accepts this card?,"['accepts card', 'accepts card']",accepts card
402,can i use my card for payment all over the world?,"['use card', 'use world']",use card
403,it will be fine to use at any establishment that accepts mastercard,"['accepts mastercard', 'accepts mastercard']",accepts mastercard
404,where can the card be used?,['used card'],Unknown
405,can my card be used everywhere?,['used card'],used card
406,are there any limits on where i can use my card?,"['use card', 'use card']",use card
407,what stores can i sue my card?,"['sue card', 'sue card']",Unknown
408,can i use my card anywhere i want?,"['use card', 'want card']",use card
409,is there anywhere my card will not be accepted?,['accepted card'],Unknown
410,what are the rules to where i can use my card?,"['use card', 'use card']",use card
411,do you know where my card will be accepted?,['accepted card'],Unknown
412,what places can i use my card?,"['use card', 'use card']",Unknown
413,is my card accepted everywhere?,['accepted card'],accepted card
414,what places will accept my card for payment?,"['accept card', 'accept payment']",accept card
415,does this card work everywhere?,['work card'],work card
416,what businesses accept this card?,"['accept card', 'accept card']",accept card
417,where can i use my card?,"['use card', 'use card']",use card
418,which outlets accept my card?,"['accept card', 'accept card']",accept card
419,i am traveling to germany will i be able to use my card there?,"['use card', 'use card']",Unknown
420,what stores will take my credit card as payment?,"['take card', 'credit card', 'take payment']",credit card
421,is there any place i cannot use my card?,"['use card', 'use card']",Unknown
422,will i be able to use my card anywhere?,"['use card', 'use card']",use card
423,is my card usable anywhere?,[' card'], card
424,is it acceptable to use my card anywhere?,"['use card', 'use card']",use card
425,can i use my card everywhere?,"['use card', 'use card']",Unknown
426,where is my card accepted?,['accepted card'],Unknown
427,where can i pay with my debit or credit card?,"['credit card', 'pay card']",pay card
428,where should my card work?,['work card'],work card
429,areas card is accpeted,"['areas card', 'accpeted card']",areas card
430,places i can use the card,"['use card', 'use card']",Unknown
431,can i make online purchases with my card?,"['make purchases', 'online purchases', 'make card']",online purchases
432,does every place of business accept this card?,"['accept card', 'accept card']",accept card
433,what places will accept my card?,"['accept card', 'accept card']",Unknown
434,can i use my card anywere?,"['use card', 'use card']",use card
435,will any business take this card?,"['take card', 'take card']",Unknown
436,will filling stations accept my card?,"['accept card', 'filling stations', 'accept card']",filling stations
437,do i have to verify my identity?,"['verify identity', 'verify identity']",Unknown
438,why do you need to know so much about me,"['know ', 'know ']",know 
439,why did i need to verfiy my identity?,"['verfiy identity', 'verfiy identity']",verfiy identity
440,i cannot verify my identity,"['verify identity', 'verify identity']",Unknown
441,i do not have what is required to prove my identity,"['prove identity', 'prove identity']",Unknown
442,why doesn't the app believe i am who i say i am?,['say app'],say app
443,i am having trouble verifying my identity,"['verifying identity', 'verifying identity']",Unknown
444,what do i do if my verification failed,['failed verification'],failed verification
445,it is impossible to verify my identity,"['verify identity', 'verify identity']",verify identity
446,the app doesn't know it's me,['know app'],Unknown
447,i'm having trouble verifying my id,"['verifying d', 'verifying d']",Unknown
448,app does not recognize me,"['recognize ', 'recognize app']",recognize app
449,help my verify my id,"['verify d', 'verify d']",verify d
450,the app failed to verify my identity,"['verify identity', 'verify identity']",verify identity
451,i can't verify my id,"['verify d', 'verify d']",verify d
452,i can't prove my identity,"['prove identity', 'prove identity']",prove identity
453,i am not being recognized by the app,['recognized app'],Unknown
454,why isn't my id being verified?,['verified d'],Unknown
455,the app will not let me into my account,"['let ', 'let account']",let account
456,i am having trouble proving my identity,"['proving identity', 'proving identity']",proving identity
457,i cannot prove my own identity,"['prove identity', 'own identity', 'prove identity']",Unknown
458,my id won't be verified!,['verified d'],Unknown
459,i can not get the app to know it is me,['know app'],Unknown
460,i can't verify my identity,"['verify identity', 'verify identity']",verify identity
461,the app doesn't recognize me,"['recognize ', 'recognize app']",recognize app
462,i am having difficulties to verify my identity,"['verify identity', 'verify identity']",Unknown
463,the app doesn't believe that i am me,['believe app'],believe app
464,what's with not verifying my id?,"['verifying d', 'verifying d']",Unknown
465,what do i need to verify my id?,"['verify d', 'verify d']",verify d
466,i tried verifying my id but it won't let me,"['let d', 'let d']",Unknown
467,how do i show this stupid system that this is really my identity?,"['show system', 'stupid system', 'show identity']",Unknown
468,i am experiencing difficulty providing my identity,"['providing identity', 'providing identity']",Unknown
469,i a having trouble proving my identity,"['proving identity', 'proving identity']",proving identity
470,how long will it take for my id to verify?,['verify d'],verify d
471,why am i not able to verify my id?,"['verify d', 'verify d']",Unknown
472,it doesn't let me verify my identity,"['verify identity', 'verify identity']",verify identity
473,app doesnt think its me,['its app'],its app
474,why am i having trouble verifying my id?,"['verifying d', 'verifying d']",verifying d
475,i am having issues with identity verification,"['having issues', 'identity verification', 'having verification']",having issues
476,the app won't let me log in as myself,['log app'],log app
477,why can't i verify my identity?,"['verify identity', 'verify identity']",verify identity
478,why can't i verify my id?,"['verify d', 'verify d']",verify d
479,for some reason i am having a problem with verifying my identity,"['verifying identity', 'verifying identity']",verifying identity
480,what do i do with my card pin?,"['card pin', 'do pin']",card pin
481,is the pin delivered separately?,['delivered pin'],delivered pin
482,i do not have my pin,"['have pin', 'have pin']",have pin
483,are pin separately?,['pin '],Unknown
484,i cannot seem to find my pin where is it?,"['find pin', 'find pin']",Unknown
485,how do i set-up my pin for the new card?,"['setup pin', 'new card', 'setup card']",new card
486,how do i find my card pin?,"['find pin', 'card pin', 'find pin']",Unknown
487,is my card pin saved in the app,"['card pin', 'saved app']",card pin
488,i don't know where to look to find my pin,"['find pin', 'find pin']",find pin
489,where in the app can i find out about my new pin,"['new pin', 'find pin']",new pin
490,where in the app can i find my pin?,"['find pin', 'find pin']",find pin
491,i just got my new card but am not sure how to check its pin,"['check pin', 'new card', 'check pin']",new card
492,do i need a pin,"['need pin', 'need pin']",need pin
493,if i need a pin for my card where is it located?,"['need pin', 'located card']",need pin
494,what is my card pin,"['card pin', ' pin']",card pin
495,and what about the card's pin?,[' pin'], pin
496,about this card pin?,"['card pin', ' pin']",card pin
497,i received my card but not my pin,"['received card', 'received pin']",received card
498,why can't i see my pin?,"['see pin', 'see pin']",Unknown
499,what is the process for setting up a pin,"['setting pin', 'setting pin']",setting pin
500,does my pin come with my card?,['come card'],come card
501,where can i find the card pin?,"['find pin', 'card pin', 'find pin']",Unknown
502,why isn't my pin available yet?,[' pin'], pin
503,is my pin located on my account somewhere?,['located account'],located account
504,please help in finding my card pin thank you!,"['thank pin', 'card pin', 'thank pin']",card pin
505,where is my pin number located?,"['pin number', 'located number']",located number
506,i still don't have my pin,"['have pin', 'have pin']",have pin
507,so what about the card pin?,"['card pin', ' pin']",card pin
508,i cannot locate the card pin,"['locate pin', 'card pin', 'locate pin']",Unknown
509,i need my pin,"['need pin', 'need pin']",need pin
510,where can i find my pin?,"['find pin', 'find pin']",find pin
511,when do i receive my pin,"['receive pin', 'receive pin']",receive pin
512,help me find my card pin!,"['find pin', 'card pin', 'find pin']",Unknown
513,is pin delivered separately?,['delivered pin'],Unknown
514,i can not find my card pin,"['find pin', 'card pin', 'find pin']",Unknown
515,what do i need to do for a pin?,['do pin'],do pin
516,why can't i find my pin?,"['find pin', 'find pin']",find pin
517,can you let me know if visa is among the card scheme assignments?,"['scheme assignments', 'know assignments']",scheme assignments
518,do you use mastercard or visa?,"['use mastercard', 'use visa']",use mastercard
519,is it possible to get a visa here?,"['get visa', 'get visa']",get visa
520,how can i top up my account with a card?,"['top account', 'top card']",top account
521,where is my money i was using my card and it disappeared,"['using card', 'disappeared card']",using card
522,how can i top up by card?,['top card'],top card
523,what is the process for using my credit card to transfer money?,"['transfer money', 'credit card', 'transfer money']",Unknown
524,how do i top up my card using your app? i'm new to this,"['using app', 'using app']",using app
525,can friends add to my account,['add account'],add account
526,can i top up using my car?,"['using car', 'using car']",Unknown
527,why can't i see my topup in my wallet anymore?,"['see topup', 'see wallet']",see topup
528,use credit card to transfer money,"['transfer money', 'credit card', 'transfer money']",Unknown
529,how do my friends top up my account,"['top account', 'top account']",top account
530,i followed the instructions to transfer money using my card but then the money disappeared and i don't know what happened,"['using card', 'happened money']",using card
531,where's the money that got charged to my card? it's not showing up in my account balance,"['account balance', 'showing balance']",account balance
532,how can i top up?,['top '],Unknown
533,i am missing some funds from my account - i tried to transfer them using my credit card number and it disappeared,"['using number', 'card number', 'disappeared number']",Unknown
534,i have friends that would like to top-up my account is that possible?,"['topup account', 'topup account']",topup account
535,how do i transfer money using a credit card?,"['using card', 'credit card', 'using card']",Unknown
536,can i give my friends access to my account so they can top it up for me?,"['top access', 'top account']",top account
537,i did a top-up but i'm not seeing it in my wallet yet,"['seeing topup', 'seeing wallet']",seeing wallet
538,i know i entered the right info but my top up isn't in my balance,"['entered info', 'right info', 'entered balance']",entered info
539,will my friend be able to top off my account?,"['top account', 'top account']",top account
540,is there a way to transfer funds directly from my card?,"['transfer funds', 'transfer card']",transfer funds
541,why isn't my top up showing on my wallet?,['showing wallet'],showing wallet
542,i tried to top up using my card but now the money just disappeared!,"['using card', 'disappeared money']",disappeared money
543,help me transfer money to my credit card,"['transfer money', 'credit card', 'transfer card']",credit card
544,i tried to use my card to top up but all of the money has disappeared,"['use card', 'disappeared money']",disappeared money
545,is it possible to use my credit card to transfer money?,"['transfer money', 'credit card', 'transfer money']",Unknown
546,how can someone add money to my account?,"['add money', 'add account']",add money
547,cannot access my top up,"['access top', 'access top']",access top
548,are my friends able to add funds to my account?,"['add funds', 'add account']",add funds
549,can i transfer money to my credit card?,"['transfer money', 'credit card', 'transfer card']",Unknown
550,who else can top up my account,"['top account', 'top account']",top account
551,why is my money gone right when i attempted to top up,['top money'],top money
552,how do i transfer money using my credit card?,"['using card', 'credit card', 'using card']",Unknown
553,my friends want to top up my account,"['top account', 'top account']",top account
554,who can top up my accounts?,"['top accounts', 'top accounts']",Unknown
555,show me how to top up with my card,"['show ', 'top card']",show 
556,i topped up my card but the money disappeared,"['topped card', 'disappeared money']",disappeared money
557,what are the limits to using disposable virtual cards?,"['using cards', 'virtual cards', 'using cards']",Unknown
558,how many transactions can i do with one disposable card?,"['disposable card', 'do card']",disposable card
559,how many times can i use the disposable virtual card i have?,"['use card', 'virtual card', 'have card']",virtual card
560,i think someone is using my card to make transactions i don't remember,"['make transactions', 'remember transactions']",make transactions
561,someone is using my account,"['using account', 'using account']",using account
562,someone i don't know has used my card without permission,"['used card', 'used permission']",used card
563,my card was used without my permission,['used permission'],Unknown
564,can i freeze my card right now?,"['freeze card', 'freeze card']",freeze card
565,freeze my account it's been hacked,"['freeze account', 'hacked account']",freeze account
566,there are transactions i didn't make someone else must have used my card,"['used card', 'used card']",used card
567,can you freeze my card because someone used it while i was out of town i did not make these purchases,"['make purchases', 'make purchases']",Unknown
568,someone is using my account to do online shopping! please freeze it asap,"['freeze shopping', 'online shopping', 'freeze shopping']",online shopping
569,someone else may be using my card  there are transactions i don't recognize,"['using card', 'recognize transactions']",using card
570,what do i do to stop unauthorized transactions on my card? i was never in the place from which the transactions on my bill were made and i never made them please help!,"['made transactions', 'unauthorized transactions', 'help bill']",unauthorized transactions
571,what do i do if i think my card was improperly used?,['used card'],used card
572,how can i stop fraud on my account right now?,"['stop fraud', 'stop account']",stop fraud
573,i think my identity has been stolen can you check on unauthorized charges?,"['unauthorized charges', 'check charges']",check charges
574,i think someone else is using my card  there are transactions i didn't make,"['using card', 'make transactions']",using card
