,utterance,classes,snli
0,i need to know your exchange rates,"['know rates', 'exchange rates', 'know rates']",exchange rates
1,what exchange rates do you offer?,"['exchange rates', 'offer rates']",exchange rates
2,how did you come up with your exchange rates?,"['exchange rates', 'come rates']",exchange rates
3,where do you guys acquire your exchange rate?,"['acquire rate', 'exchange rate', 'acquire rate']",Unknown
4,how do i find the exchange rate?,"['find rate', 'exchange rate', 'find rate']",Unknown
5,what are your international exchange rates?,"['exchange rates', 'international rates', ' rates']",international rates
6,how often do your exchange rates change,"['exchange rates', 'change rates']",exchange rates
7,please advise what is the exchange rate,"['exchange rate', 'advise rate']",advise rate
8,how are exchange rates calculated?,"['exchange rates', 'calculated rates']",exchange rates
9,what are exchange rates based on,"['exchange rates', 'based rates']",exchange rates
10,what are exchange rates,"['exchange rates', ' rates']",exchange rates
11,what are the most current exchange rates?,"['exchange rates', 'current rates', ' rates']",exchange rates
12,can you explain your exchange rate policy to me?,"['explain policy', 'rate policy', 'explain policy']",Unknown
13,is it a good time to exchange?,"['good time', 'exchange time']",exchange time
14,what is the exchange rate like on this app?,"['exchange rate', ' app']",exchange rate
15,do you have a list of exchange rates?,"['have list', 'exchange rates', 'have rates']",exchange rates
16,can you tell me where you get your exchange rates?,"['get rates', 'exchange rates', 'get rates']",exchange rates
17,will i get a curreng foreign exchange rate?,"['get rate', 'exchange rate', 'foreign exchange', 'get rate']",Unknown
18,what currencies is an exchange rate calculated in?,"['exchange rate', 'calculated rate']",exchange rate
19,where do you get your exchange rates from?,"['get rates', 'exchange rates', 'get rates']",exchange rates
20,what is the base of the exchange rates?,"['exchange rates', ' rates']",exchange rates
21,what exchange rate do you use?,"['exchange rate', 'use rate']",exchange rate
22,the exchange rates are?,"['exchange rates', ' rates']",exchange rates
23,what do you base your exchange rates on?,"['base rates', 'exchange rates', 'base rates']",exchange rates
24,what foreign exchange rate will you use?,"['exchange rate', 'foreign exchange', 'use rate']",Unknown
25,how much will i get with the exchange rate?,"['exchange rate', 'get rate']",exchange rate
26,the exchange rate would be?,"['exchange rate', ' rate']",exchange rate
27,what is the exchange rate like?,"['exchange rate', ' rate']",exchange rate
28,how do your exchange rates work?,"['exchange rates', 'work rates']",exchange rates
29,what is the exchange rate?,"['exchange rate', ' rate']", rate
30,where did your guys exchange rates come from?,"['exchange rates', 'come rates']",exchange rates
31,how are you determining your exchange rates?,"['determining rates', 'exchange rates', 'determining rates']",Unknown
32,i'm trying to figure out the current exchange rate,"['figure rate', 'exchange rate', 'current rate', 'figure rate']",Unknown
33,from where are you getting your exchange rates?,"['getting rates', 'exchange rates', 'getting rates']",exchange rates
34,can you tell me the foreign exchange rate?,"['tell rate', 'exchange rate', 'foreign exchange', 'tell rate']",Unknown
35,why do your exchange rates change,"['exchange rates', 'change rates']",exchange rates
36,what kind of foreign exchange rate will i get when i exchange my money?,"['exchange money', 'exchange rate', 'foreign exchange', 'exchange money']",Unknown
37,what is my foreign exchange rate?,"['exchange rate', 'foreign exchange', ' rate']",Unknown
38,when does the rate get determined,['determined rate'],determined rate
39,what is the current exchange rate for me?,"['exchange rate', 'current rate', ' rate']",exchange rate
40,i need my card now!,"['need card', 'need card']",need card
41,my card was not in the mail again can you advise?,['advise mail'],advise mail
42,i need my card quick,"['need card', 'need card']",Unknown
43,how long will it take to get to me?,['get '],get 
44,i'm just wondering when my card will get here,['get card'],get card
45,can you get me my card fast?,"['get card', 'get card']",Unknown
46,how long will it take to deliver something to us?,"['deliver ', 'deliver ']",deliver 
47,i live in the us how long will it take for delivery?,['take delivery'],take delivery
48,when can i expect my card to be delivered to the us?,['delivered card'],delivered card
49,i need my card quickly,"['need card', 'need card']",Unknown
50,does delivery to the us take long?,['take delivery'],take delivery
51,how long will it take to arrive?,['arrive '],arrive 
52,can i have my card delivered on a specific day?,"['specific day', 'delivered day']",specific day
53,what is the difference between standard and express delivery?,"['standard delivery', ' delivery']", delivery
54,can it be delivered by a specific date?,"['specific date', 'delivered date']",delivered date
55,may i choose when it's delivered?,['delivered '],Unknown
56,i need it delivered on a certain date,"['certain date', 'delivered date']",certain date
57,when should i expect my card?,"['expect card', 'expect card']",Unknown
58,how long does it take to get my card? can i choose when to receive it?,"['receive card', 'receive card']",Unknown
59,how long will it take for the card to arrive?,['arrive card'],arrive card
60,how fast can you deliver?,['deliver '],deliver 
61,ordered awhile back what is the eta in the us?,['ordered eta'],ordered eta
62,how long should i expect for the card to arrive?,['arrive card'],arrive card
63,whats the delivery time to the united states?,"['united states', 's time']",united states
64,when will the card arrive?,['arrive card'],arrive card
65,send my card as soon as you are able to,"['send card', 'send card']",Unknown
66,when are cards delivered?,['delivered cards'],delivered cards
67,how long does shipping take to get to a us destination?,"['us destination', 'get destination']",us destination
68,can i get my card expedited?,['expedited card'],expedited card
69,how long until my card is delivered?,['delivered card'],Unknown
70,i need my card to come as soon as possible,"['as possible', 'come card']",come card
71,when can i expect to receive my new card?,"['receive card', 'new card', 'receive card']",Unknown
72,i am waiting for my card to arrive,['arrive card'],arrive card
73,i need my card as soon as possible,"['need card', 'need card']",need card
74,i need it delivered by saturday,['delivered '],Unknown
75,what's the us delivery time?,"['delivery time', ' time']",delivery time
76,when will my card arrive?,['arrive card'],arrive card
77,can i choose a date for delivery?,"['choose date', 'choose delivery']",choose date
78,can i make sure my card is delivered on a specific day?,"['specific day', 'delivered day']",specific day
79,can i have it be delivered at a certain time?,"['certain time', 'delivered time']",certain time
80,i've tried my card a bunch of times and it never worked,"['tried card', 'worked times']",tried card
81,i can't get my card to work,"['get card', 'work card']",get card
82,my card appears to be broken how can i fix it?,"['fix ', 'fix card']",fix card
83,how do i know why my card isn't working?,['working card'],Unknown
84,my card broke,['broke card'],broke card
85,my card won't work,['work card'],Unknown
86,why is my card not working?,['working card'],Unknown
87,can you please identify the problem with my bank card?,"['identify problem', 'bank card', 'identify card']",Unknown
88,how do i unblock my card using the app?,"['using app', 'using app']",Unknown
89,my card does not work,['work card'],Unknown
90,how can i get my physical card to work?,"['physical card', 'work card']",physical card
91,can someone assist me by explaining why my card is not working?,"['assist ', 'working card']",assist 
92,help me  my card doesn't work,"['help ', 'work card']",help 
93,can a card stop working?,['working card'],Unknown
94,i think my card is broken,['think card'],think card
95,why isn't my card working?,['working card'],Unknown
96,my card isn't working anymore,['working card'],Unknown
97,my card was declined today when eating and i need to know what's wrong,['know today'],Unknown
98,my card doesn't work,['work card'],Unknown
99,how can i resolve a problem where my card won't go through at all?,"['resolve problem', 'go card']",resolve problem
100,my actual card isn't working,"['actual card', 'working card']",actual card
101,is my card broken?,[' card'], card
102,i broke my card,"['broke card', 'broke card']",Unknown
103,my card stopped working,['working card'],Unknown
104,my card is broke what do i do?,['do card'],do card
105,i tried using my card today and it's not working can you help me?,"['help card', 'help today']",help today
106,my card stopped working when i use it,"['use ', 'use card']",use card
107,i can't use my card,"['use card', 'use card']",use card
108,need help with my card it's not working,"['need help', 'working card']",need help
109,i cannot use my card,"['use card', 'use card']",Unknown
110,the card i've got seems to be broken,['seems card'],seems card
111,my card isn't working,['working card'],Unknown
112,my card suddenly quit working,['working card'],Unknown
113,i have tried to use my card several times and it does not work,"['use card', 'several times', 'work times']",several times
114,the card i have doesn't work,['work card'],Unknown
115,my card doesn't accept any transaction at all what's wrong??,"['accept transaction', 'accept transaction']",Unknown
116,how can i check if my card is working?,['working card'],Unknown
117,nothing goes through on my card,['goes card'],goes card
118,how do i find out why my card won't work?,['work card'],work card
119,could it be that i deactivated my card its not working?,"['deactivated card', 'working card']",deactivated card
120,my entire gym bag including my wallet was stolen out of my locker today everything in my wallet is gone - how do i block the card to make it can't be used?,"['block card', 'gym bag', 'entire bag', 'used card']",Unknown
121,i can't find my card and think it may have been stolen,"['find card', 'stolen card']",stolen card
122,someone stole my card i need to report it stolen i made a police report already but how do i report it with you?,"['report report', 'police report', 'report report']",Unknown
123,i cant find my card it's gone,"['find card', 'gone card']",gone card
124,my card is lost! what can i do?,['do card'],Unknown
125,i lost my card,"['lost card', 'lost card']",Unknown
126,oh no!  i lost my card!  help!,"['lost card', 'lost help']",lost card
127,i believe my card has been stolen what can i do about this situation? it's urgent,['do situation'],do situation
128,help! someone stole my card!,"['stole card', 'stole card']",stole card
129,help  i have a stolen card!,"['have card', 'stolen card', 'stolen card']",Unknown
130,card is lost please help,['help card'],help card
131,how do i report my card stolen?,['stolen card'],stolen card
132,my card is gone i think it was stolen,['stolen card'],stolen card
133,is a copy of the police report necessary for completing the report process?,"['completing process', 'report process', 'completing process']",Unknown
134,i lost my wallet today with all my credit cards will you please block the card and send a replacement?,"['send replacement', 'credit cards', 'send replacement']",credit cards
135,how do i deal with a stolen card?,"['stolen card', 'stolen card']",stolen card
136,can you freeze my card it was stolen,"['freeze card', 'stolen card']",stolen card
137,help!  i can't find my card,"['find card', 'find card']",find card
138,what should i do if i lost my card?,"['lost card', 'lost card']",Unknown
139,i need help with a lost card,"['need help', 'lost card', 'lost card']",Unknown
140,i think my card was stolen,['stolen card'],stolen card
141,someone stole my wallet earlier today not sure exactly when probably on piccadilly circus can you check if there were any attempts to use the card and obviously block it?,"['block card', 'piccadilly circus', 'block card']",Unknown
142,i think i lost my card  i dont know how long it has been missing can you see if maybe someone else has been using it?,"['using card', 'using card']",using card
143,how can i freeze a stolen card?,"['freeze card', 'stolen card', 'stolen card']",Unknown
144,what should i do if my card is missing?,['missing card'],missing card
145,my bags were stolen i need a new card but need to cancel the stolen one,"['cancel one', 'stolen one', 'stolen one']",Unknown
146,somehow i am missing my card  what should i do?,"['missing card', 'do card']",missing card
147,my card was taken from me,['taken card'],taken card
148,my card got lost,['lost card'],lost card
149,some idiot stole my card,"['stole card', 'stole card']",stole card
150,how do i report my card lost or stolen?,['stolen card'],stolen card
151,my card is lost! what do i do now?,['do card'],do card
152,i'm in spain and my stuff has been stolen my card was with it and i need a new one shipped and the old one frozen,"['old one', 'frozen one']",frozen one
153,i believe my credit card was stolen,"['credit card', 'stolen card']",credit card
154,how do i report a stolen card?,"['report card', 'stolen card', 'stolen card']",Unknown
155,somebody has stolen my card i need help please,"['need help', 'need help']",Unknown
156,i cannot find my credit card,"['find card', 'credit card', 'find card']",Unknown
157,are you able to locate my card?,"['locate card', 'locate card']",Unknown
158,my card got stolen!,['stolen card'],stolen card
159,help me please!  my card was stolen!,"['help ', 'stolen card']",stolen card
160,how old do i need to be to get an account for myself,"['get account', 'get account']",Unknown
161,how young can i be to open my own account?,"['open account', 'own account', 'open account']",Unknown
162,how old do i have to be?,['have '],Unknown
163,can i open an account for a child?,"['open account', 'open child']",open child
164,how old do we have to be?,['have '],Unknown
165,how do i go about setting up an account for my daughter?,"['setting account', 'setting daughter']",setting account
166,is there an age minimum?,"['age minimum', ' minimum']", minimum
167,what is the youngest age in order to have an account?,"[' account', 'youngest age', ' account']",Unknown
168,what age do i have to be?,['have age'],have age
169,can my daughter open an account?,"['open account', 'open account']",open account
170,what is the minimum age to open an account?,"['open account', 'minimum age', 'open account']",Unknown
171,what is the minimum age?,"['minimum age', ' age']", age
172,i am only 17 can i make an account?,"['make account', 'make account']",Unknown
173,could i open an account for my children?,"['open account', 'open children']",open children
174,what is the age to open an account?,"['open account', 'open account']",open account
175,how do i open up an account for my child?,"['open account', 'open child']",open child
176,can i open a bank account for my newborn baby?,"['open account', 'bank account', 'newborn baby', 'open baby']",newborn baby
177,how old do i have to be to open an account?,"['open account', 'open account']",open account
178,do you offer services for children to have money saving experience?,"['have experience', 'saving experience', 'have experience']",Unknown
179,if my kids wanted to use your service how old would they have to be?,"['use service', 'have service']",use service
180,can my 19 year old daughter open a savings account at the bank?,"['open account', 'savings account', 'old daughter', 'open bank']",old daughter
181,how old do you have to be to get an account?,"['get account', 'get account']",get account
182,what's the minimum age for opening an account?,"['opening account', 'minimum age', 'opening account']",Unknown
183,i would like an account for my children how do i go about doing this?,"['doing account', 'doing children']",doing children
184,can my children have their own account?,"['have account', 'own account', 'have account']",Unknown
185,is it possible to open an account for my children?,"['open account', 'open children']",open children
186,do my kids have to be a certain age to use this service?,"['use service', 'certain age', 'use service']",Unknown
187,how old do you have to be to be able to open an account?,"['open account', 'open account']",open account
188,is there an age limit?,"['age limit', ' limit']", limit
189,what are the age requirements for opening an account?,"['opening account', 'age requirements', 'opening account']",age requirements
190,will i be able to open an account for my daughter,"['open account', 'open daughter']",open daughter
191,how old do i need to be to open an account?,"['open account', 'open account']",open account
192,what age can sign up for services?,['sign services'],sign services
193,how old do my kids have to be to use your service?,"['use service', 'use service']",use service
194,what age do my kids need to be to use your service?,"['use service', 'use service']",use service
195,how old do my children need to be to open an account?,"['open account', 'open account']",Unknown
196,how old does my kids need to be to open an account?,"['open account', 'old need', 'open account']",Unknown
197,how young can someone be in order to open an account?,"['open account', 'open account']",open account
198,what is the youngest someone can be to open an account?,"['open account', 'open account']",open account
199,how old does one have to be to have an account with the bank?,"['have account', 'have bank']",have account
200,how do i get my pin unlocked?,['unlocked pin'],unlocked pin
201,where can i view my pin?,"['view pin', 'view pin']",Unknown
202,will you reinstate my pin?,"['reinstate pin', 'reinstate pin']",reinstate pin
203,i accidentally blocked my pin how do i reset it?,"['reset pin', 'reset pin']",reset pin
204,how do i unblock my pin after entering it wrong too many times?,"['entering pin', 'many times', 'entering times']",entering pin
205,i used the wrong ping too many times and now the account is blocked  how do i unblock?,"['used ping', 'many times', 'unblock account']",unblock account
206,i need help because i drunken blocked my card?,"['blocked card', 'blocked card']",Unknown
207,how do i reset my pin i can't seem to use my card?,"['use card', 'use card']",use card
208,when i put the wrong pin too much i got blocked so can you help me unblock my pin,"['unblock pin', 'wrong pin', 'unblock pin']",Unknown
209,my pin was blocked how do i make it so i can use it?,"['use ', 'use pin']",use pin
210,how many tries do i have to enter my pin before i'm blocked?,"['enter pin', 'many tries', 'blocked pin']",Unknown
211,what should i do if i've tried to enter my pin too often?,"['enter pin', 'enter pin']",enter pin
212,i have exceeded the number of times i can try my pin,"['try pin', 'try pin']",try pin
213,how can i unblock a blocked pin number for my account?,"['unblock number', 'pin number', 'blocked number', 'blocked account']",Unknown
214,what do i do if the bank machine won't accept my pin attempts anymore?,"['accept attempts', 'pin attempts', 'accept attempts']",pin attempts
215,can you unlock my pin? i think i entered the wrong pin too many times,"['entered pin', 'many times', 'entered times']",entered times
216,how do i deal with a blocked pin?,"['blocked pin', 'blocked pin']",blocked pin
217,i attempted to use my card while i was intoxicated and i failed to input my pin and the machine kept my card how soon can i have it back?,"['have card', 'have card']",have card
218,can i unblock my card using the app?,"['using app', 'using app']",Unknown
219,i'v exhausted all the of times i can try my pin,"['try pin', 'try pin']",try pin
220,how can i unlock my pin from too many tries?,"['unlock pin', 'many tries', 'unlock tries']",many tries
221,help! i forgot my pin and have been locked out of using my card,"['using card', 'using card']",using card
222,my account is blocked how do i log in now,['log account'],log account
223,why did i get blocked?,['blocked '],blocked 
224,are you able to unblock my pin?,"['unblock pin', 'unblock pin']",Unknown
225,can you assist me with unblocking my pin? i put it in wrong too many times,"['put pin', 'many times', 'put times']",put times
226,i entered the wrong pin too many times and now i am blocked  help me unblock!,"['entered pin', 'many times', 'unblock times']",Unknown
227,my pins seems to be blocked can you unblock it please,"['unblock ', 'unblock pins']",unblock pins
228,can you unblock my pin after too many wrong pin attempts?,"['unblock pin', 'pin attempts', 'wrong attempts', 'unblock attempts']",Unknown
229,what can you do to unblock my pin?,"['unblock pin', 'unblock pin']",unblock pin
230,my pin is blocked what do i do?,['do pin'],do pin
231,can i reactivate my pin?,"['reactivate pin', 'reactivate pin']",reactivate pin
232,how do i reset my pin?,"['reset pin', 'reset pin']",reset pin
233,can i unblock my pin?,"['unblock pin', 'unblock pin']",Unknown
234,how do i unblock my pin?,"['unblock pin', 'unblock pin']",unblock pin
235,my card's frozen what can i do?,['do card'],do card
236,how can i unlock the pin?,"['unlock pin', 'unlock pin']",Unknown
237,since my pin is blocked would you help me unblock it?,"['unblock ', 'unblock pin']",unblock pin
238,my pin is not working and i need assistance,"['need assistance', 'need assistance']",Unknown
239,where can i get my pin unblocked?,['unblocked pin'],Unknown
240,are contactless payments enabled on my new card?,"['new card', 'enabled card']",new card
241,my contanctless has stopped working,['working contanctless'],Unknown
242,what is required documents for new card process ?,"['card process', 'new process', 'required process']",card process
243,i don't know what's wrong my contactless stopped working tried it in a few different places today and it didn't work in any of them,"['tried ', 'different places', 'work today']",different places
244,how do i get the contactless feature to work for my card?,"['contactless feature', 'work card']",contactless feature
245,i tried to pay contactless at the bus today and it didn't work any ideas why?,"['work ideas', 'work ideas']",work ideas
246,i've been unable to pay contactless with my card for over a week now is there a way to fix this issue?,"['fix issue', 'fix issue']",Unknown
247,do you know why my contactless won't work?,['work '],Unknown
248,my contactless payments have not been completed successfully,"['contactless payments', 'completed payments']",contactless payments
249,do i need to replace my card if it didn't work when i tried to pay contactless at the shop today?,"['pay card', 'pay today']",pay card
250,for some reason my contactless has stopped working i don't know what the problem is what can i do?,['do problem'],do problem
251,i couldn't use my contactless this morning it wasn't accepted,"['use ', 'accepted morning']",use 
252,contactless isn't working for me,['working '],Unknown
253,why wouldn't the contactless payment work when i tried to pay at the bus today?,"['contactless payment', 'pay today']",contactless payment
254,how do i check my security settings to allow contactless pay?,"['allow pay', 'security settings', 'contactless pay', 'allow pay']",Unknown
255,what can i do if contactless doesn't work?,['work '],Unknown
256,fix my contactless,"['fix ', 'fix ']",fix 
257,how can i make my contactless work for the metro?,"['make work', 'contactless work', 'make metro']",Unknown
258,my contactless is not working,['working contactless'],Unknown
259,can you help my fix my contactless?,"['fix ', 'fix ']",fix 
260,for some reason my contactless won't work for me,['work contactless'],Unknown
261,i'm unable to use contactless payments for purchases,"['use payments', 'contactless payments', 'use purchases']",Unknown
262,when i tried to pay for my bus ride the contactless payment wouldn't work how can i prevent this in the future?,"['prevent ', 'bus ride', 'contactless payment', 'prevent future']",Unknown
263,the nfc payment wouldn't work on the bus today help?,"['nfc payment', 'help today']",nfc payment
264,i wanted to use my card contactless but it doesn't seem to be working what could be the problem?,"['use card', 'working problem']",use card
265,how do i make contactless work,"['make work', 'contactless work', 'make work']",Unknown
266,what is the charges for new card?,"['new card', ' card']",new card
267,the contactless i have won't work,['work '],Unknown
268,why isn't my contactless not working?,['working '],Unknown
269,i wanted to use my contactless at the metro today but it didn't accept it!,"['accept ', 'accept today']",accept 
270,it didnt work when i tried to pay contactless at the bus today why?,"['pay ', 'pay today']",pay today
271,i am not able to do contactless,['do '],Unknown
272,how do i use contactless payments?,"['use payments', 'contactless payments', 'use payments']",Unknown
273,help me with my contactless which isn't working,"['help ', 'working ']",help 
274,how can i fix a problem where contactless isn't working?,"['fix problem', 'working problem']",fix problem
275,how do i use contactless pay?,"['use pay', 'contactless pay', 'use pay']",Unknown
276,how do i enable contactless pay?,"['enable pay', 'contactless pay', 'enable pay']",Unknown
277,do i need to make a regular payment before a contactless one?,"['make payment', 'contactless one', 'make one']",make payment
278,how can i find out where my contactless works?,['works '],Unknown
279,should i reinstall the payment app?,"['reinstall app', 'payment app', 'reinstall app']",Unknown
280,how much do you charge to accept transfers,"['accept transfers', 'accept transfers']",Unknown
